{
  "version": 1,
  "result_type": "implementation_summary",
  "agent": "planner",
  "source_handoff_id": "2026-04-16T183200Z-0001",
  "created_at": "2026-04-16T18:35:00Z",
  "status": "done",
  "summary": "Implementation plan for three workflow improvements: (1) file-based handover via self-service JSON reading, (2) UX visibility via summaries and status updates, (3) AGENT.md prerequisite parsing and enforcement. Requires updates to orchestrator prompts (coding-boss.txt, docs.txt) with specific sections for handoff writing, summary generation, and prerequisite handling.",
  "files_changed": [],
  "files_intentionally_not_changed": [
    "*.json schema files (no changes needed)"
  ],
  "tests_run": [],
  "known_risks_or_limitations": [
    "AGENT.md format must be standardized for parsing to work",
    "No validation that subagent actually reads the file",
    "Status updates depend on orchestrator prompt compliance"
  ],
  "review_focus": [
    "Is the file-path self-service model clear?",
    "Is AGENT.md parsing robust enough?",
    "Are status updates visible but not verbose?"
  ],
  "plan_steps_completed": [
    "1. Handoff Writer Section: Add section to orchestrator prompts that writes JSON to .opencode/sessions/<session_id>/handoffs/<seq>.json with all payload fields",
    "2. Self-Service Delegation: Change delegation pattern from inline JSON to 'Read handoff from <filePath>'",
    "3. Summary Generator: Add auto-generation of 2-3 sentence summary from handoff payload for user display",
    "4. Status Update Hook: Add phase transition messages at routing, planning, execution, review, recording boundaries",
    "5. AGENT.md Parser: Add section to read AGENT.md, find '## Prerequisites' or '## Requirements', execute bash code blocks",
    "6. Prerequisite Enforcement: Check and execute prerequisites BEFORE delegating to subagent"
  ],
  "deviations_from_plan": [],
  "symbols_changed": [],
  "verification_results": [
    "Verify handoff JSON written to correct path",
    "Verify subagent can read handoff file",
    "Verify summary displayed to user",
    "Verify prerequisite executed before delegation"
  ],
  "remaining_followups": [
    "Document AGENT.md format standard for prerequisites",
    "Add user_summary field to schemas if explicit extraction desired"
  ]
}
