{
  "version": 1,
  "result_type": "review_result",
  "agent": "reviewer",
  "source_handoff_id": "2026-04-16T183200Z-0004",
  "created_at": "2026-04-16T19:05:00Z",
  "status": "approve",
  "summary": "The clarification is clear, complete, and consistently applied across both orchestrator prompts. The change properly documents the hybrid workflow where subagents return structured output and orchestrator writes result artifacts.",
  "findings": [
    "Clarification present in coding-boss.txt line 35: matches exactly the intended text",
    "Clarification present in docs.txt line 22: matches exactly the intended text",
    "Both orchestrators now explicitly state subagents return structured output and orchestrator writes result artifacts",
    "Consistent with existing prompt statements about handling blocked results (lines 24 and 12 respectively)",
    "Aligns with result.schema.json - subagents return structured output conforming to the schema",
    "No other orchestrator prompts need this change - agent-architect.txt is a subagent, not an orchestrator"
  ],
  "checks_performed": [
    "Verified clarification exists in both coding-boss.txt and docs.txt",
    "Checked text matches exactly between handoff description and actual prompt files",
    "Verified consistency across both orchestrator prompts",
    "Confirmed result.schema.json alignment - subagents return structured output that conforms to schema",
    "Scanned other prompt files for potential missing orchestrators",
    "Considered edge cases: blocked results handling, subagent direct writes, error cases"
  ],
  "recommended_next_step": "approve"
}
